{
  "schemaVersion": 1,
  "intelligenceVersion": "1.2.0",
  "project": null,
  "sources": [
    {
      "id": "source-c383304bb60cfc62",
      "kind": "spreadsheet",
      "label": "Owner-approved nbm acceptance workbook",
      "uri": null,
      "mimeType": "application/vnd.openxmlformats-officedocument.spreadsheetml.sheet",
      "sizeBytes": 10990,
      "provenance": "user-supplied",
      "purpose": "Verified public facts, services, offices and the acceptance intent the build must satisfy.",
      "rightsStatus": "approved-for-use",
      "assetStatus": "approved",
      "sourceRole": "content",
      "sourceChannel": "upload",
      "instructionAuthority": "none",
      "publishUseAllowed": true,
      "contentHash": "b3a98cd20f594d33b401c845fb28487aac251dcdf6b7fa2310cf2ae302f01ad9",
      "cacheKey": "3c0336d3dd28f42fc83e3df36906657b7c1ff53fe891b1091b11273ee9c93cfe",
      "extractorVersion": "1.1.0",
      "extractionSummary": {
        "type": "xlsx",
        "truncated": false
      },
      "variantCount": 0
    },
    {
      "id": "source-f19d64ac4fa91009",
      "kind": "url",
      "label": "https://www.nbm.bz/",
      "uri": "https://www.nbm.bz/",
      "mimeType": "text/html",
      "sizeBytes": 22090,
      "provenance": "existing-site",
      "purpose": "Cross-check the facts the workbook records. Reference only: public visibility is not a republication right.",
      "rightsStatus": "reference-only",
      "assetStatus": "do-not-use",
      "sourceRole": "primary-brand",
      "sourceChannel": "website",
      "instructionAuthority": "none",
      "publishUseAllowed": false,
      "contentHash": "cdead04ce63df89074073318b685a9aa373bc583da67f3b12b72ff7f563c7c31",
      "cacheKey": "c59dd9d14d58b9ccae235384e583a53df939cc4529b2620d431f2abbf3eb697c",
      "extractorVersion": "1.1.0",
      "extractionSummary": {
        "type": "html",
        "truncated": false
      },
      "variantCount": 0
    },
    {
      "id": "source-4ab6a89f71caa78d",
      "kind": "url",
      "label": "https://www.nbm.bz/about",
      "uri": "https://www.nbm.bz/about",
      "mimeType": "text/html",
      "sizeBytes": 19537,
      "provenance": "existing-site",
      "purpose": "Cross-check the facts the workbook records. Reference only: public visibility is not a republication right.",
      "rightsStatus": "reference-only",
      "assetStatus": "do-not-use",
      "sourceRole": "primary-brand",
      "sourceChannel": "website",
      "instructionAuthority": "none",
      "publishUseAllowed": false,
      "contentHash": "a53f85519a37388f5dfc7d4ace651425b3ecf65b32d1a3984fb74cd65d1cc5fc",
      "cacheKey": "ac9170efad2afb01a6e57474de629e128cd05f4607719b81161682a881c3edfe",
      "extractorVersion": "1.1.0",
      "extractionSummary": {
        "type": "html",
        "truncated": false
      },
      "variantCount": 0
    },
    {
      "id": "source-b2f2bdd39330ca84",
      "kind": "url",
      "label": "https://www.nbm.bz/our-team",
      "uri": "https://www.nbm.bz/our-team",
      "mimeType": "text/html",
      "sizeBytes": 23222,
      "provenance": "existing-site",
      "purpose": "Cross-check the facts the workbook records. Reference only: public visibility is not a republication right.",
      "rightsStatus": "reference-only",
      "assetStatus": "do-not-use",
      "sourceRole": "primary-brand",
      "sourceChannel": "website",
      "instructionAuthority": "none",
      "publishUseAllowed": false,
      "contentHash": "3e716e3a2058b02fe049fa2940f2c223257fd971a966094eb442865acc1e2d44",
      "cacheKey": "e55742946f4aba62c727025f11481c8e918e2ce556a6bccf7af4939410e711a4",
      "extractorVersion": "1.1.0",
      "extractionSummary": {
        "type": "html",
        "truncated": false
      },
      "variantCount": 0
    },
    {
      "id": "source-5ef254552c079e8e",
      "kind": "url",
      "label": "https://www.nbm.bz/services",
      "uri": "https://www.nbm.bz/services",
      "mimeType": "text/html",
      "sizeBytes": 18046,
      "provenance": "existing-site",
      "purpose": "Cross-check the facts the workbook records. Reference only: public visibility is not a republication right.",
      "rightsStatus": "reference-only",
      "assetStatus": "do-not-use",
      "sourceRole": "primary-brand",
      "sourceChannel": "website",
      "instructionAuthority": "none",
      "publishUseAllowed": false,
      "contentHash": "28c21d3a8623cbd3f46b3772880b4732c43422ee1add422b48cabe43f2408d84",
      "cacheKey": "456079b068bb23eca1ceef8d0799a813a596a36d601208945c103cc26da67a0a",
      "extractorVersion": "1.1.0",
      "extractionSummary": {
        "type": "html",
        "truncated": false
      },
      "variantCount": 0
    },
    {
      "id": "source-a1aafa910656718a",
      "kind": "url",
      "label": "https://www.nbm.bz/projects",
      "uri": "https://www.nbm.bz/projects",
      "mimeType": "text/html",
      "sizeBytes": 52310,
      "provenance": "existing-site",
      "purpose": "Cross-check the facts the workbook records. Reference only: public visibility is not a republication right.",
      "rightsStatus": "reference-only",
      "assetStatus": "do-not-use",
      "sourceRole": "primary-brand",
      "sourceChannel": "website",
      "instructionAuthority": "none",
      "publishUseAllowed": false,
      "contentHash": "c1de4e5e7b0973ec1e52583b888872f3ffcf3b92a5fbfc1c5ef827dcf15d24d5",
      "cacheKey": "1a73b3bbba13752e900fd4aa15aaf209a9260d195e27bf5f8de52eb510d03e5a",
      "extractorVersion": "1.1.0",
      "extractionSummary": {
        "type": "html",
        "truncated": false
      },
      "variantCount": 0
    },
    {
      "id": "source-285bb499c2df68de",
      "kind": "url",
      "label": "https://www.nbm.bz/nbm-news",
      "uri": "https://www.nbm.bz/nbm-news",
      "mimeType": "text/html",
      "sizeBytes": 25782,
      "provenance": "existing-site",
      "purpose": "Cross-check the facts the workbook records. Reference only: public visibility is not a republication right.",
      "rightsStatus": "reference-only",
      "assetStatus": "do-not-use",
      "sourceRole": "primary-brand",
      "sourceChannel": "website",
      "instructionAuthority": "none",
      "publishUseAllowed": false,
      "contentHash": "98762ee47b7fc26181d74ce944723bc692aeb54aa8a94bfa35220950629ac87b",
      "cacheKey": "86de708370899163c457e5cbabc7f8310a4743b584ec9bad9fbbc75b3d418917",
      "extractorVersion": "1.1.0",
      "extractionSummary": {
        "type": "html",
        "truncated": false
      },
      "variantCount": 0
    },
    {
      "id": "source-225fbe320a0d9dc1",
      "kind": "url",
      "label": "https://www.nbm.bz/contact",
      "uri": "https://www.nbm.bz/contact",
      "mimeType": "text/html",
      "sizeBytes": 15418,
      "provenance": "existing-site",
      "purpose": "Cross-check the facts the workbook records. Reference only: public visibility is not a republication right.",
      "rightsStatus": "reference-only",
      "assetStatus": "do-not-use",
      "sourceRole": "primary-brand",
      "sourceChannel": "website",
      "instructionAuthority": "none",
      "publishUseAllowed": false,
      "contentHash": "50ab1c0b2ce31956819dcfc8a14d76bf9e32c2940d24f860921a53cd8f2b7c0c",
      "cacheKey": "edd08a54f48b22764795f155141c32dd95816f3d7ed8182439f9a279854097ed",
      "extractorVersion": "1.1.0",
      "extractionSummary": {
        "type": "html",
        "truncated": false
      },
      "variantCount": 0
    },
    {
      "id": "source-d33e8556df74796f",
      "kind": "url",
      "label": "https://www.nbm.bz/works/refurbishment-of-the-met-hotel-leeds",
      "uri": "https://www.nbm.bz/works/refurbishment-of-the-met-hotel-leeds",
      "mimeType": "text/html",
      "sizeBytes": 18429,
      "provenance": "existing-site",
      "purpose": "Cross-check the facts the workbook records. Reference only: public visibility is not a republication right.",
      "rightsStatus": "reference-only",
      "assetStatus": "do-not-use",
      "sourceRole": "primary-brand",
      "sourceChannel": "website",
      "instructionAuthority": "none",
      "publishUseAllowed": false,
      "contentHash": "d639331b6a4a0087e9e7546b1e78b565a6b386e2da81532ed35d4070c490e014",
      "cacheKey": "03fafa7c93f2bb66f2d27c4eca2d57223d4401c10ac016109e5efba660de0afe",
      "extractorVersion": "1.1.0",
      "extractionSummary": {
        "type": "html",
        "truncated": false
      },
      "variantCount": 0
    }
  ],
  "facts": [
    {
      "id": "fact-9e4d86d95de76af7",
      "path": "identity.name",
      "value": "nbm Construction Cost Consultants",
      "sourceId": "source-c383304bb60cfc62",
      "provenance": "user-supplied",
      "confidence": 1,
      "verification": "user-provided",
      "evidence": [
        {
          "sourceId": "source-c383304bb60cfc62",
          "provenance": "user-supplied",
          "confidence": 1,
          "verification": "user-provided"
        }
      ]
    },
    {
      "id": "fact-262b3eb20b8e3770",
      "path": "identity.legalName",
      "value": "NBM CONSTRUCTION COST CONSULTANTS LIMITED",
      "sourceId": "source-c383304bb60cfc62",
      "provenance": "user-supplied",
      "confidence": 1,
      "verification": "user-provided",
      "evidence": [
        {
          "sourceId": "source-c383304bb60cfc62",
          "provenance": "user-supplied",
          "confidence": 1,
          "verification": "user-provided"
        }
      ]
    },
    {
      "id": "fact-6271fcb7c32936a6",
      "path": "contact.address",
      "value": "9 Woodside Crescent, Glasgow, G3 7UL",
      "sourceId": "source-c383304bb60cfc62",
      "provenance": "user-supplied",
      "confidence": 1,
      "verification": "user-provided",
      "evidence": [
        {
          "sourceId": "source-c383304bb60cfc62",
          "provenance": "user-supplied",
          "confidence": 1,
          "verification": "user-provided"
        }
      ]
    },
    {